{
  "$comment": "Standard area units. These are exact definitions, not rates: international yard (1959) = 0.9144 m, so 1 sq ft = 0.09290304 m², 1 sq yd (gaj) = 0.83612736 m², 1 acre = 4,840 sq yd = 4046.8564224 m²; 1 hectare = 10,000 m².",
  "dataset": "land-units",
  "status": "verified",
  "verified_by": "exact definitions (no rate to look up); recomputed in tools-core/test/area.test.ts",
  "last_verified": "2026-10-09",
  "sources": [
    {
      "url": "https://en.wikipedia.org/wiki/International_yard_and_pound",
      "title": "International yard and pound (1959): yard = 0.9144 m"
    },
    {
      "url": "https://proofwiki.org/wiki/Definition:Acre/Conversion_Factors",
      "title": "Acre = 4,840 sq yd = 4046.8564224 m²"
    }
  ],
  "units": [
    {
      "id": "sq_ft",
      "label_en": "Square feet (sq ft)",
      "label_hi": "वर्ग फ़ुट",
      "sq_m": 0.09290304
    },
    {
      "id": "sq_yd",
      "label_en": "Square yards / gaj",
      "label_hi": "वर्ग गज़ / गज़",
      "sq_m": 0.83612736
    },
    { "id": "sq_m", "label_en": "Square metres (sq m)", "label_hi": "वर्ग मीटर", "sq_m": 1 },
    { "id": "acre", "label_en": "Acres", "label_hi": "एकड़", "sq_m": 4046.8564224 },
    { "id": "hectare", "label_en": "Hectares", "label_hi": "हेक्टेयर", "sq_m": 10000 }
  ]
}
