{
  "$comment": "Guntha for Maharashtra and Karnataka. A guntha is 1/40 of an acre (a square of 33 ft = 1,089 sq ft). Karnataka RTC extracts state extent as acres.guntas (e.g. 2.10 = 2 acres 10 guntas); Maharashtra 7/12 extracts print hectare-are, while guntha is used in sale talk. No government page could be fetched from the build environment, so this stays draft until the owner (or someone they name) checks the checklist and signs verified_by.",
  "dataset": "land-units",
  "states": ["MH", "KA"],
  "status": "draft",
  "verified_by": "not verified",
  "last_verified": "2026-10-09",
  "verification_checklist": [
    "Open a Karnataka RTC (https://landrecords.karnataka.gov.in) and confirm extent is written as acres.guntas with 40 guntas to an acre.",
    "Open a Maharashtra 7/12 (https://bhulekh.mahabhumi.gov.in) or ask a talathi, and confirm 1 guntha = 1/40 acre (about 1.0117 are).",
    "If both hold, set status to verified, put your name in verified_by, update last_verified, and open the PR with the approved-by-owner label."
  ],
  "sources": [
    {
      "url": "https://landrecords.karnataka.gov.in",
      "title": "Karnataka Bhoomi land records (RTC, acres.guntas)"
    },
    {
      "url": "https://bhulekh.mahabhumi.gov.in",
      "title": "Maharashtra Mahabhumi 7/12 (hectare-are)"
    },
    {
      "url": "https://1acre.in/land-unit-converter/karnataka",
      "title": "1acre.in: 1 guntha = 1,089 sq ft (101.17 sq m), Karnataka"
    },
    {
      "url": "https://1acre.in/land-unit-converter/maharashtra",
      "title": "1acre.in: Maharashtra land units"
    },
    {
      "url": "https://indialandconverter.in/karnataka/belgaum/convert-guntha-to-acre",
      "title": "1 gunta = 0.025 acre"
    }
  ],
  "units": [
    {
      "id": "guntha",
      "label_en": "Guntha / gunta (Maharashtra, Karnataka)",
      "label_hi": "गुंठा / गुंटा (महाराष्ट्र, कर्नाटक)",
      "sq_ft": 1089,
      "sq_m": 101.17141056
    }
  ]
}
